subdomain_key,subdomain_label,procedure_code,procedure_title,field,operation_group,operation_key,agency,submission_methods,processing_time_values,document_group_count,result_count,raw_data_available,source_url
nang_ngach,Nâng ngạch,1.014578,"Chính sách hỗ trợ đào tạo, đào tạo lại, đào tạo nâng cao cho người lao động phục vụ công nghiệp bán dẫn, trí tuệ nhân tạo, công nghệ số",Giáo dục nghề nghiệp (G07-LĐ06),ho_tro_nang_cao_trinh_do_ky_nang,chinh_sach_ho_tro_dao_tao_dao_tao_lai_dao_tao_nang_cao_cho_nguoi_lao_dong_phuc_vu_cong_nghiep_ban_dan_tri_tue_nhan_tao_cong_nghe_so,Sở Giáo dục và Đào tạo tỉnh Bắc Ninh,Trực tiếp | Trực tuyến | Dịch vụ bưu chính,15 ngày làm việc | 15 ngày làm việc | 15 ngày làm việc,0,1,True,https://dichvucong.gov.vn/thu-tuc-hanh-chinh/019d7cdd-823f-74ae-98c0-11294b187942
nang_ngach,Nâng ngạch,1.014747,"Hỗ trợ người lao động tham gia đào tạo, nâng cao trình độ kỹ năng nghề (Cấp tỉnh)",Việc làm,ho_tro_nang_cao_trinh_do_ky_nang,ho_tro_nguoi_lao_dong_tham_gia_dao_tao_nang_cao_trinh_do_ky_nang_nghe_cap_tinh,Sở Nội Vụ,Trực tuyến | Dịch vụ bưu chính | Trực tiếp,15 ngày làm việc | 15 ngày làm việc | 15 ngày làm việc,3,1,True,https://dichvucong.gov.vn/thu-tuc-hanh-chinh/019d2bfb-2b27-7518-89b4-431db32c4295
nang_ngach,Nâng ngạch,1.014754,"Hỗ trợ người sử dụng lao động đào tạo, bồi dưỡng, nâng cao trình độ kỹ năng nghề để duy trì việc làm cho người lao động (Cấp tỉnh)",Việc làm,ho_tro_dao_tao_duy_tri_viec_lam,ho_tro_nguoi_su_dung_lao_dong_dao_tao_boi_duong_nang_cao_trinh_do_ky_nang_nghe_de_duy_tri_viec_lam_cho_nguoi_lao_dong_cap_tinh,Trung tâm Dịch vụ việc làm; Sở Nội Vụ,Trực tuyến | Dịch vụ bưu chính | Trực tiếp,20 ngày làm việc | 20 ngày làm việc | 20 ngày làm việc,0,3,True,https://dichvucong.gov.vn/thu-tuc-hanh-chinh/019d2bfb-2b4b-73ee-a30b-5d75c3cf3253
nang_ngach,Nâng ngạch,1.115483,"Đề nghị hỗ trợ tham gia đào tạo, bồi dưỡng, nâng cao trình độ kỹ năng nghề (Cấp tỉnh)",Việc làm,ho_tro_nang_cao_trinh_do_ky_nang,de_nghi_ho_tro_tham_gia_dao_tao_boi_duong_nang_cao_trinh_do_ky_nang_nghe_cap_tinh,Ủy ban nhân dân cấp tỉnh,Trực tiếp | Trực tuyến | Dịch vụ bưu chính,7 ngày làm việc | 7 ngày làm việc | 7 ngày làm việc,2,2,True,https://dichvucong.gov.vn/thu-tuc-hanh-chinh/019f3227-f72a-77c0-90d9-dc65819f8d7e
nang_ngach,Nâng ngạch,2.002821,"Hỗ trợ đào tạo nghề cho người lao động ở khu vực nông thôn, người lao động là thanh niên",Việc làm,ho_tro_dao_tao_nghe,ho_tro_dao_tao_nghe_cho_nguoi_lao_dong_o_khu_vuc_nong_thon_nguoi_lao_dong_la_thanh_nien,Ủy ban nhân dân cấp xã,Trực tuyến | Dịch vụ bưu chính | Trực tiếp,7 ngày làm việc | 7 ngày làm việc | 7 ngày làm việc,4,2,True,https://dichvucong.gov.vn/thu-tuc-hanh-chinh/019d2bfb-4a52-722d-90e3-52eae73487a0
